{"schema_version":"1.0","scenario_id":"f06-point-in-time-loss-repaired","pair_id":"F06","variant":"repaired","seed":1206,"service":{"name":"northstar-registry","journey":"validated observation remains recoverable","regions":["west","east"]},"workload":{"valid_events":12000,"bad_events":30,"arrival_rate":120,"priority_demand":450,"optional_demand":100,"recovery_demand":100,"duration_minutes":45},"slo":{"target":0.999,"window_days":28},"fault_events":[{"minute":5,"type":"authoritative_data_loss"}],"controls":{"bounded_degradation":true,"multiwindow_burn_alerts":true,"journey_sli":true,"incident_command":true,"restore_verification":true,"point_in_time_recovery":true,"degraded_capacity_reserve":true,"fenced_failback":true,"operator_safety_checks":true},"recovery":{"last_durable_version":804,"last_required_version":808,"disruption_minute":5,"minimum_service_minute":44,"backup_valid":true,"old_epoch":42,"new_epoch":43,"source":"backup-west-18","target":"restore-east","remaining_capacity":700},"expected":{"target_invariant":"I07","repaired_invariants":["I01","I02","I03","I04","I05","I06","I07","I08","I09","I10","I11","I12"]}}
