{"schema_version":"1.0","scenario_id":"f08-dual-authority-failback-repaired","pair_id":"F08","variant":"repaired","seed":1208,"service":{"name":"northstar-registry","journey":"publication authority remains singular during failback","regions":["west","east"]},"workload":{"valid_events":30000,"bad_events":300,"arrival_rate":400,"priority_demand":500,"optional_demand":100,"recovery_demand":100,"duration_minutes":50},"slo":{"target":0.999,"window_days":28},"fault_events":[{"minute":15,"type":"stale_primary_returns"}],"controls":{"bounded_degradation":true,"multiwindow_burn_alerts":true,"journey_sli":true,"incident_command":true,"restore_verification":true,"point_in_time_recovery":true,"degraded_capacity_reserve":true,"fenced_failback":true,"operator_safety_checks":true},"recovery":{"last_durable_version":808,"last_required_version":808,"disruption_minute":0,"minimum_service_minute":32,"backup_valid":true,"old_epoch":42,"new_epoch":43,"source":"registry-east","target":"registry-west","remaining_capacity":750},"expected":{"target_invariant":"I09","repaired_invariants":["I01","I02","I03","I04","I05","I06","I07","I08","I09","I10","I11","I12"]}}
